<?xml version="1.0" standalone="no"?>
<!DOCTYPE BinderTranscriptInfo [
<!-- For an XML document to be "valid" we must define all the standard entities -->
<!ENTITY lt "&#38;#60;" >
<!ENTITY gt "&#40;" >
<!ENTITY amp "&#38;#38;" >
<!ENTITY apos "&#39;" >
<!ENTITY quot "&#34;" >

<!-- Non-breaking space for explicitly preserving whitespace -->
<!ENTITY nbsp "&#32;" >

<!-- 
 (element)   Element count must be 1   
 (element)?  Element count must be 0 or 1  
 (element)+  Element count must be 1 to N  
 (element)*  Element count must be 0 to N  
-->

<!ELEMENT BinderTranscriptInfo (StructureEntries, Issues, Annotations, (Video)?, Transcript) >

<!-- ++++++++ StructureEntries ++++++++ -->

<!ELEMENT StructureEntries (StructureEntry)* >

<!ELEMENT StructureEntry (TranscriptRange, EntryTitle, EntryText, (StructureEntry)*) >
<!ATTLIST StructureEntry Type   NMTOKEN #REQUIRED >

<!ELEMENT EntryTitle (#PCDATA) >
<!ELEMENT EntryText (#PCDATA) >


<!-- ++++++++ TranscriptRange ++++++++ -->

<!ELEMENT TranscriptRange (StartPoint, EndPoint) >
<!ELEMENT StartPoint EMPTY >
<!ATTLIST StartPoint LineID NMTOKEN #REQUIRED
                     Pos    NMTOKEN #REQUIRED >
<!ELEMENT EndPoint   EMPTY >
<!ATTLIST EndPoint   LineID NMTOKEN #REQUIRED
                     Pos    NMTOKEN #REQUIRED >


<!-- ++++++++ Issues ++++++++ -->

<!ELEMENT Issues (Issue)* >

<!ELEMENT Issue (#PCDATA) >
<!ATTLIST Issue ID     ID      #REQUIRED 
    Color  CDATA #REQUIRED >

<!-- ++++++++ Annotations ++++++++ -->

<!ELEMENT Annotations (Annotation)* >

<!ELEMENT Annotation (DateTime, TranscriptRange, IssueList, Comment, Attachment) >
<!ATTLIST Annotation ID           ID        #REQUIRED
                     FollowUpFlag (Yes|No)  "No" >

<!ELEMENT DateTime EMPTY >
<!ATTLIST DateTime Year   NMTOKEN #REQUIRED
                   Month  NMTOKEN #REQUIRED
                   Day    NMTOKEN #REQUIRED
                   Hour   NMTOKEN #REQUIRED
                   Minute NMTOKEN #REQUIRED
                   Second NMTOKEN #REQUIRED >

<!ELEMENT IssueList (IssueID)+ >
<!ELEMENT IssueID EMPTY >
<!ATTLIST IssueID IDREF IDREF #REQUIRED >

<!ELEMENT Comment (#PCDATA) >
<!ELEMENT Attachment (Locator) >
<!ELEMENT Locator (#PCDATA) >


<!-- ++++++++ Video ++++++++ -->

<!ELEMENT Video (VideoSources) >
<!ELEMENT VideoSources (VideoSource)* >

<!ELEMENT VideoSource (MediaLabel, Offsets) >
<!ATTLIST VideoSource ID     ID              #REQUIRED 
                      Type   (file | stream) "file"
                      Format (Mpeg2 | Mpeg3) "Mpeg2"
                      Source NMTOKEN         #REQUIRED >

<!ELEMENT MediaLabel (#PCDATA) >
<!ELEMENT Offsets (Offset)* >
<!ELEMENT Offset EMPTY>
<!ATTLIST Offset ID  ID      #REQUIRED 
                 Off NMTOKEN #REQUIRED >


<!-- ++++++++ Transcripts ++++++++ -->

<!ELEMENT Transcript (Head, Body) >

<!-- Head element -->
<!ELEMENT Head (Title, Date, (Flags, Reporter, Company, Witness, Examiner, DeposedBy, GUID)?) >

<!-- The head elements -->

<!ELEMENT Title (#PCDATA) >
<!ELEMENT Date (#PCDATA) >
<!ELEMENT Flags EMPTY>
<!ATTLIST Flags IsDraft (Yes | No) "No"
                IsSealed (Yes | No) "No">
<!ELEMENT Reporter (#PCDATA) >
<!ELEMENT Company (#PCDATA) >
<!ELEMENT Witness (#PCDATA) >
<!ELEMENT Examiner (#PCDATA) >
<!ELEMENT DeposedBy (#PCDATA) >
<!ELEMENT GUID (#PCDATA) >


<!-- Body of transcript consists of the layout information, and the text itself -->
<!ELEMENT Body    (Layout, Text) >

<!-- Layout section of transcript -->
<!ELEMENT Layout  (Page)+ >
<!ELEMENT Page    (Line)* >
<!ATTLIST Page    ID     ID      #REQUIRED
                  Number NMTOKEN #REQUIRED
                  Visible (Yes | No) "Yes" >
<!ELEMENT Line    (SpanRef)+ >
<!ATTLIST Line    ID     ID      #REQUIRED
                  Number NMTOKEN #IMPLIED
                  Indent NMTOKEN #IMPLIED >
<!ELEMENT SpanRef EMPTY >
<!ATTLIST SpanRef IDREF  IDREF   #REQUIRED >

<!-- Text section of transcript -->
<!ELEMENT Text    (Speech | Span)+ >
<!ELEMENT Speech  (Span)+ >
<!ATTLIST Speech  Type   NMTOKEN #REQUIRED >
<!ELEMENT Span    (#PCDATA) >
<!ATTLIST Span    ID     ID      #REQUIRED
                  Begin  CDATA   #IMPLIED 
                  xml:space (preserve) "preserve">

]>
<BinderTranscriptInfo>
  <StructureEntries>

    <StructureEntry Type="Exhibit">

      <TranscriptRange>

        <StartPoint LineID="Line2101" Pos="0"/>

        <EndPoint LineID="Line2101" Pos="255"/>

      </TranscriptRange>

      <EntryTitle>exhibit 34 Marked</EntryTitle>

      <EntryText></EntryText>

    </StructureEntry>

    <StructureEntry Type="Exhibit">

      <TranscriptRange>

        <StartPoint LineID="Line2321" Pos="0"/>

        <EndPoint LineID="Line2321" Pos="255"/>

      </TranscriptRange>

      <EntryTitle>exhibit 35 Marked</EntryTitle>

      <EntryText></EntryText>

    </StructureEntry>

    <StructureEntry Type="Exhibit">

      <TranscriptRange>

        <StartPoint LineID="Line2519" Pos="0"/>

        <EndPoint LineID="Line2519" Pos="255"/>

      </TranscriptRange>

      <EntryTitle>exhibit 36 Marked</EntryTitle>

      <EntryText></EntryText>

    </StructureEntry>

    <StructureEntry Type="Exhibit">

      <TranscriptRange>

        <StartPoint LineID="Line2717" Pos="0"/>

        <EndPoint LineID="Line2717" Pos="255"/>

      </TranscriptRange>

      <EntryTitle>exhibit 37 Marked</EntryTitle>

      <EntryText></EntryText>

    </StructureEntry>

    <StructureEntry Type="Exhibit">

      <TranscriptRange>

        <StartPoint LineID="Line3215" Pos="0"/>

        <EndPoint LineID="Line3215" Pos="255"/>

      </TranscriptRange>

      <EntryTitle>exhibit 38 Marked</EntryTitle>

      <EntryText></EntryText>

    </StructureEntry>

    <StructureEntry Type="Exhibit">

      <TranscriptRange>

        <StartPoint LineID="Line3809" Pos="0"/>

        <EndPoint LineID="Line3809" Pos="255"/>

      </TranscriptRange>

      <EntryTitle>exhibit 39 Marked</EntryTitle>

      <EntryText></EntryText>

    </StructureEntry>

    <StructureEntry Type="Exhibit">

      <TranscriptRange>

        <StartPoint LineID="Line4922" Pos="0"/>

        <EndPoint LineID="Line4922" Pos="255"/>

      </TranscriptRange>

      <EntryTitle>exhibit 40 Marked</EntryTitle>

      <EntryText></EntryText>

    </StructureEntry>

    <StructureEntry Type="Exhibit">

      <TranscriptRange>

        <StartPoint LineID="Line5223" Pos="0"/>

        <EndPoint LineID="Line5223" Pos="255"/>

      </TranscriptRange>

      <EntryTitle>exhibit 41 Marked</EntryTitle>

      <EntryText></EntryText>

    </StructureEntry>

    <StructureEntry Type="Exhibit">

      <TranscriptRange>

        <StartPoint LineID="Line6401" Pos="0"/>

        <EndPoint LineID="Line6401" Pos="255"/>

      </TranscriptRange>

      <EntryTitle>exhibit 42 Marked</EntryTitle>

      <EntryText></EntryText>

    </StructureEntry>

    <StructureEntry Type="Exhibit">

      <TranscriptRange>

        <StartPoint LineID="Line6621" Pos="0"/>

        <EndPoint LineID="Line6621" Pos="255"/>

      </TranscriptRange>

      <EntryTitle>exhibit 43 Marked</EntryTitle>

      <EntryText></EntryText>

    </StructureEntry>

    <StructureEntry Type="Exhibit">

      <TranscriptRange>

        <StartPoint LineID="Line8905" Pos="0"/>

        <EndPoint LineID="Line8905" Pos="255"/>

      </TranscriptRange>

      <EntryTitle>exhibit 44 Marked</EntryTitle>

      <EntryText></EntryText>

    </StructureEntry>

    <StructureEntry Type="Exhibit">

      <TranscriptRange>

        <StartPoint LineID="Line9608" Pos="0"/>

        <EndPoint LineID="Line9608" Pos="255"/>

      </TranscriptRange>

      <EntryTitle>exhibit 45 Marked</EntryTitle>

      <EntryText></EntryText>

    </StructureEntry>

    <StructureEntry Type="Exhibit">

      <TranscriptRange>

        <StartPoint LineID="Line2106" Pos="0"/>

        <EndPoint LineID="Line2106" Pos="255"/>

      </TranscriptRange>

      <EntryTitle>exhibit 34</EntryTitle>

      <EntryText></EntryText>

    </StructureEntry>

    <StructureEntry Type="Exhibit">

      <TranscriptRange>

        <StartPoint LineID="Line10706" Pos="0"/>

        <EndPoint LineID="Line10706" Pos="255"/>

      </TranscriptRange>

      <EntryTitle>exhibit 34</EntryTitle>

      <EntryText></EntryText>

    </StructureEntry>

    <StructureEntry Type="Exhibit">

      <TranscriptRange>

        <StartPoint LineID="Line2401" Pos="0"/>

        <EndPoint LineID="Line2401" Pos="255"/>

      </TranscriptRange>

      <EntryTitle>exhibit 35</EntryTitle>

      <EntryText></EntryText>

    </StructureEntry>

    <StructureEntry Type="Exhibit">

      <TranscriptRange>

        <StartPoint LineID="Line10711" Pos="0"/>

        <EndPoint LineID="Line10711" Pos="255"/>

      </TranscriptRange>

      <EntryTitle>exhibit 35</EntryTitle>

      <EntryText></EntryText>

    </StructureEntry>

    <StructureEntry Type="Exhibit">

      <TranscriptRange>

        <StartPoint LineID="Line2523" Pos="0"/>

        <EndPoint LineID="Line2523" Pos="255"/>

      </TranscriptRange>

      <EntryTitle>exhibit 36</EntryTitle>

      <EntryText></EntryText>

    </StructureEntry>

    <StructureEntry Type="Exhibit">

      <TranscriptRange>

        <StartPoint LineID="Line10716" Pos="0"/>

        <EndPoint LineID="Line10716" Pos="255"/>

      </TranscriptRange>

      <EntryTitle>exhibit 36</EntryTitle>

      <EntryText></EntryText>

    </StructureEntry>

    <StructureEntry Type="Exhibit">

      <TranscriptRange>

        <StartPoint LineID="Line2721" Pos="0"/>

        <EndPoint LineID="Line2721" Pos="255"/>

      </TranscriptRange>

      <EntryTitle>exhibit 37</EntryTitle>

      <EntryText></EntryText>

    </StructureEntry>

    <StructureEntry Type="Exhibit">

      <TranscriptRange>

        <StartPoint LineID="Line10721" Pos="0"/>

        <EndPoint LineID="Line10721" Pos="255"/>

      </TranscriptRange>

      <EntryTitle>exhibit 37</EntryTitle>

      <EntryText></EntryText>

    </StructureEntry>

    <StructureEntry Type="Exhibit">

      <TranscriptRange>

        <StartPoint LineID="Line3419" Pos="0"/>

        <EndPoint LineID="Line3419" Pos="255"/>

      </TranscriptRange>

      <EntryTitle>exhibit 38</EntryTitle>

      <EntryText></EntryText>

    </StructureEntry>

    <StructureEntry Type="Exhibit">

      <TranscriptRange>

        <StartPoint LineID="Line4123" Pos="0"/>

        <EndPoint LineID="Line4123" Pos="255"/>

      </TranscriptRange>

      <EntryTitle>exhibit 38</EntryTitle>

      <EntryText></EntryText>

    </StructureEntry>

    <StructureEntry Type="Exhibit">

      <TranscriptRange>

        <StartPoint LineID="Line4208" Pos="0"/>

        <EndPoint LineID="Line4208" Pos="255"/>

      </TranscriptRange>

      <EntryTitle>exhibit 38</EntryTitle>

      <EntryText></EntryText>

    </StructureEntry>

    <StructureEntry Type="Exhibit">

      <TranscriptRange>

        <StartPoint LineID="Line10801" Pos="0"/>

        <EndPoint LineID="Line10801" Pos="255"/>

      </TranscriptRange>

      <EntryTitle>exhibit 38</EntryTitle>

      <EntryText></EntryText>

    </StructureEntry>

    <StructureEntry Type="Exhibit">

      <TranscriptRange>

        <StartPoint LineID="Line4305" Pos="0"/>

        <EndPoint LineID="Line4305" Pos="255"/>

      </TranscriptRange>

      <EntryTitle>exhibit 39</EntryTitle>

      <EntryText></EntryText>

    </StructureEntry>

    <StructureEntry Type="Exhibit">

      <TranscriptRange>

        <StartPoint LineID="Line10806" Pos="0"/>

        <EndPoint LineID="Line10806" Pos="255"/>

      </TranscriptRange>

      <EntryTitle>exhibit 39</EntryTitle>

      <EntryText></EntryText>

    </StructureEntry>

    <StructureEntry Type="Exhibit">

      <TranscriptRange>

        <StartPoint LineID="Line5002" Pos="0"/>

        <EndPoint LineID="Line5002" Pos="255"/>

      </TranscriptRange>

      <EntryTitle>exhibit 40</EntryTitle>

      <EntryText></EntryText>

    </StructureEntry>

    <StructureEntry Type="Exhibit">

      <TranscriptRange>

        <StartPoint LineID="Line10811" Pos="0"/>

        <EndPoint LineID="Line10811" Pos="255"/>

      </TranscriptRange>

      <EntryTitle>exhibit 40</EntryTitle>

      <EntryText></EntryText>

    </StructureEntry>

    <StructureEntry Type="Exhibit">

      <TranscriptRange>

        <StartPoint LineID="Line5303" Pos="0"/>

        <EndPoint LineID="Line5303" Pos="255"/>

      </TranscriptRange>

      <EntryTitle>exhibit 41</EntryTitle>

      <EntryText></EntryText>

    </StructureEntry>

    <StructureEntry Type="Exhibit">

      <TranscriptRange>

        <StartPoint LineID="Line5614" Pos="0"/>

        <EndPoint LineID="Line5614" Pos="255"/>

      </TranscriptRange>

      <EntryTitle>exhibit 41</EntryTitle>

      <EntryText></EntryText>

    </StructureEntry>

    <StructureEntry Type="Exhibit">

      <TranscriptRange>

        <StartPoint LineID="Line10816" Pos="0"/>

        <EndPoint LineID="Line10816" Pos="255"/>

      </TranscriptRange>

      <EntryTitle>exhibit 41</EntryTitle>

      <EntryText></EntryText>

    </StructureEntry>

    <StructureEntry Type="Exhibit">

      <TranscriptRange>

        <StartPoint LineID="Line6405" Pos="0"/>

        <EndPoint LineID="Line6405" Pos="255"/>

      </TranscriptRange>

      <EntryTitle>exhibit 42</EntryTitle>

      <EntryText></EntryText>

    </StructureEntry>

    <StructureEntry Type="Exhibit">

      <TranscriptRange>

        <StartPoint LineID="Line10821" Pos="0"/>

        <EndPoint LineID="Line10821" Pos="255"/>

      </TranscriptRange>

      <EntryTitle>exhibit 42</EntryTitle>

      <EntryText></EntryText>

    </StructureEntry>

    <StructureEntry Type="Exhibit">

      <TranscriptRange>

        <StartPoint LineID="Line6701" Pos="0"/>

        <EndPoint LineID="Line6701" Pos="255"/>

      </TranscriptRange>

      <EntryTitle>exhibit 43</EntryTitle>

      <EntryText></EntryText>

    </StructureEntry>

    <StructureEntry Type="Exhibit">

      <TranscriptRange>

        <StartPoint LineID="Line10901" Pos="0"/>

        <EndPoint LineID="Line10901" Pos="255"/>

      </TranscriptRange>

      <EntryTitle>exhibit 43</EntryTitle>

      <EntryText></EntryText>

    </StructureEntry>

    <StructureEntry Type="Exhibit">

      <TranscriptRange>

        <StartPoint LineID="Line8910" Pos="0"/>

        <EndPoint LineID="Line8910" Pos="255"/>

      </TranscriptRange>

      <EntryTitle>exhibit 44</EntryTitle>

      <EntryText></EntryText>

    </StructureEntry>

    <StructureEntry Type="Exhibit">

      <TranscriptRange>

        <StartPoint LineID="Line9205" Pos="0"/>

        <EndPoint LineID="Line9205" Pos="255"/>

      </TranscriptRange>

      <EntryTitle>exhibit 44</EntryTitle>

      <EntryText></EntryText>

    </StructureEntry>

    <StructureEntry Type="Exhibit">

      <TranscriptRange>

        <StartPoint LineID="Line9213" Pos="0"/>

        <EndPoint LineID="Line9213" Pos="255"/>

      </TranscriptRange>

      <EntryTitle>exhibit 44</EntryTitle>

      <EntryText></EntryText>

    </StructureEntry>

    <StructureEntry Type="Exhibit">

      <TranscriptRange>

        <StartPoint LineID="Line9221" Pos="0"/>

        <EndPoint LineID="Line9221" Pos="255"/>

      </TranscriptRange>

      <EntryTitle>exhibit 44</EntryTitle>

      <EntryText></EntryText>

    </StructureEntry>

    <StructureEntry Type="Exhibit">

      <TranscriptRange>

        <StartPoint LineID="Line9504" Pos="0"/>

        <EndPoint LineID="Line9504" Pos="255"/>

      </TranscriptRange>

      <EntryTitle>exhibit 44</EntryTitle>

      <EntryText></EntryText>

    </StructureEntry>

    <StructureEntry Type="Exhibit">

      <TranscriptRange>

        <StartPoint LineID="Line9702" Pos="0"/>

        <EndPoint LineID="Line9702" Pos="255"/>

      </TranscriptRange>

      <EntryTitle>exhibit 44</EntryTitle>

      <EntryText></EntryText>

    </StructureEntry>

    <StructureEntry Type="Exhibit">

      <TranscriptRange>

        <StartPoint LineID="Line10906" Pos="0"/>

        <EndPoint LineID="Line10906" Pos="255"/>

      </TranscriptRange>

      <EntryTitle>exhibit 44</EntryTitle>

      <EntryText></EntryText>

    </StructureEntry>

    <StructureEntry Type="Exhibit">

      <TranscriptRange>

        <StartPoint LineID="Line9613" Pos="0"/>

        <EndPoint LineID="Line9613" Pos="255"/>

      </TranscriptRange>

      <EntryTitle>exhibit 45</EntryTitle>

      <EntryText></EntryText>

    </StructureEntry>

    <StructureEntry Type="Exhibit">

      <TranscriptRange>

        <StartPoint LineID="Line9817" Pos="0"/>

        <EndPoint LineID="Line9817" Pos="255"/>

      </TranscriptRange>

      <EntryTitle>exhibit 45</EntryTitle>

      <EntryText></EntryText>

    </StructureEntry>

    <StructureEntry Type="Exhibit">

      <TranscriptRange>

        <StartPoint LineID="Line9820" Pos="0"/>

        <EndPoint LineID="Line9820" Pos="255"/>

      </TranscriptRange>

      <EntryTitle>exhibit 45</EntryTitle>

      <EntryText></EntryText>

    </StructureEntry>

    <StructureEntry Type="Exhibit">

      <TranscriptRange>

        <StartPoint LineID="Line10912" Pos="0"/>

        <EndPoint LineID="Line10912" Pos="255"/>

      </TranscriptRange>

      <EntryTitle>exhibit 45</EntryTitle>

      <EntryText></EntryText>

    </StructureEntry>

  </StructureEntries>

  <Issues>

  </Issues>

  <Annotations>

  </Annotations>

  <Summaries>

  </Summaries>

  <DocLevelIssues>

  </DocLevelIssues>

  <DocLevelNotes>

  </DocLevelNotes>

  <Transcript>

    <Head>

      <Title>Delany, Craig M. - Vol. 2</Title>

      <Date>2012-6-12</Date>

      <Flags IsDraft="No" IsSealed="No"/>

      <GUID>625a810f-8a4e-4a58-9023-6e3a6e812dd3</GUID>

    </Head>

    <Body>

      <Layout>

        <Page ID="Page0" Number="402">

          <Line ID="Line000" Number="1">

            <SpanRef IDREF="Span0"/>

          </Line>

          <Line ID="Line001" Number="2">

            <SpanRef IDREF="Span1"/>

          </Line>

          <Line ID="Line002" Number="3">

            <SpanRef IDREF="Span2"/>

          </Line>

          <Line ID="Line003">

            <SpanRef IDREF="Span3"/>

          </Line>

          <Line ID="Line004" Number="4" Indent="26">

            <SpanRef IDREF="Span4"/>

          </Line>

          <Line ID="Line005">

            <SpanRef IDREF="Span5"/>

          </Line>

          <Line ID="Line006" Number="5">

            <SpanRef IDREF="Span6"/>

          </Line>

          <Line ID="Line007" Number="6" Indent="5">

            <SpanRef IDREF="Span7"/>

          </Line>

          <Line ID="Line008">

            <SpanRef IDREF="Span8"/>

          </Line>

          <Line ID="Line009" Number="7">

            <SpanRef IDREF="Span9"/>

          </Line>

          <Line ID="Line010">

            <SpanRef IDREF="Span10"/>

          </Line>

          <Line ID="Line011" Number="8">

            <SpanRef IDREF="Span11"/>

          </Line>

          <Line ID="Line012">

            <SpanRef IDREF="Span12"/>

          </Line>

          <Line ID="Line013" Number="9">

            <SpanRef IDREF="Span13"/>

          </Line>

          <Line ID="Line014">

            <SpanRef IDREF="Span14"/>

          </Line>

          <Line ID="Line015" Number="10" Indent="26">

            <SpanRef IDREF="Span15"/>

          </Line>

          <Line ID="Line016" Indent="5">

            <SpanRef IDREF="Span16"/>

          </Line>

          <Line ID="Line017" Number="11" Indent="5">

            <SpanRef IDREF="Span17"/>

          </Line>

          <Line ID="Line018" Number="12">

            <SpanRef IDREF="Span18"/>

          </Line>

          <Line ID="Line019" Number="13">

            <SpanRef IDREF="Span19"/>

          </Line>

          <Line ID="Line020" Number="14" Indent="10">

            <SpanRef IDREF="Span20"/>

          </Line>

          <Line ID="Line021">

            <SpanRef IDREF="Span21"/>

          </Line>

          <Line ID="Line022" Number="15">

          </Line>

          <Line ID="Line023" Indent="20">

            <SpanRef IDREF="Span22"/>

          </Line>

          <Line ID="Line024" Number="16" Indent="20">

            <SpanRef IDREF="Span23"/>

          </Line>

          <Line ID="Line025" Number="17" Indent="1">

            <SpanRef IDREF="Span24"/>

          </Line>

          <Line ID="Line026" Number="18" Indent="15">

            <SpanRef IDREF="Span25"/>

          </Line>

          <Line ID="Line027" Number="19" Indent="19">

            <SpanRef IDREF="Span26"/>

          </Line>

          <Line ID="Line028" Number="20" Indent="5">

            <SpanRef IDREF="Span27"/>

          </Line>

          <Line ID="Line029" Number="21">

            <SpanRef IDREF="Span28"/>

          </Line>

          <Line ID="Line030" Number="22">

            <SpanRef IDREF="Span29"/>

          </Line>

          <Line ID="Line031" Number="23">

            <SpanRef IDREF="Span30"/>

          </Line>

          <Line ID="Line032" Number="24">

            <SpanRef IDREF="Span31"/>

          </Line>

          <Line ID="Line033" Number="25">

            <SpanRef IDREF="Span32"/>

          </Line>

        </Page>

        <Page ID="Page1" Number="403">

          <Line ID="Line100" Number="1">

            <SpanRef IDREF="Span33"/>

          </Line>

          <Line ID="Line101" Number="2">

          </Line>

          <Line ID="Line102" Number="3">

            <SpanRef IDREF="Span34"/>

          </Line>

          <Line ID="Line103" Number="4">

            <SpanRef IDREF="Span35"/>

          </Line>

          <Line ID="Line104" Number="5">

            <SpanRef IDREF="Span36"/>

          </Line>

          <Line ID="Line105" Number="6">

            <SpanRef IDREF="Span37"/>

          </Line>

          <Line ID="Line106" Number="7" Indent="5">

            <SpanRef IDREF="Span38"/>

          </Line>

          <Line ID="Line107" Number="8" Indent="5">

            <SpanRef IDREF="Span39"/>

          </Line>

          <Line ID="Line108" Number="9" Indent="5">

            <SpanRef IDREF="Span40"/>

          </Line>

          <Line ID="Line109" Number="10">

            <SpanRef IDREF="Span41"/>

          </Line>

          <Line ID="Line110" Number="11" Indent="5">

            <SpanRef IDREF="Span42"/>

          </Line>

          <Line ID="Line111" Number="12">

          </Line>

          <Line ID="Line112" Number="13">

          </Line>

          <Line ID="Line113" Number="14">

            <SpanRef IDREF="Span43"/>

          </Line>

          <Line ID="Line114" Number="15">

            <SpanRef IDREF="Span44"/>

          </Line>

          <Line ID="Line115" Number="16">

            <SpanRef IDREF="Span45"/>

          </Line>

          <Line ID="Line116" Number="17" Indent="5">

            <SpanRef IDREF="Span46"/>

          </Line>

          <Line ID="Line117" Number="18" Indent="5">

            <SpanRef IDREF="Span47"/>

          </Line>

          <Line ID="Line118" Number="19">

            <SpanRef IDREF="Span48"/>

          </Line>

          <Line ID="Line119" Number="20" Indent="5">

            <SpanRef IDREF="Span49"/>

          </Line>

          <Line ID="Line120" Number="21">

          </Line>

          <Line ID="Line121" Number="22">

          </Line>

          <Line ID="Line122" Number="23">

          </Line>

          <Line ID="Line123" Number="24">

          </Line>

          <Line ID="Line124" Number="25">

          </Line>

        </Page>

        <Page ID="Page2" Number="404">

          <Line ID="Line200" Number="1">

            <SpanRef IDREF="Span50"/>

          </Line>

          <Line ID="Line201" Number="2">

          </Line>

          <Line ID="Line202" Number="3">

            <SpanRef IDREF="Span51"/>

          </Line>

          <Line ID="Line203" Number="4">

            <SpanRef IDREF="Span52"/>

          </Line>

          <Line ID="Line204" Number="5" Indent="5">

            <SpanRef IDREF="Span53"/>

          </Line>

          <Line ID="Line205" Number="6" Indent="5">

            <SpanRef IDREF="Span54"/>

          </Line>

          <Line ID="Line206" Number="7">

            <SpanRef IDREF="Span55"/>

          </Line>

          <Line ID="Line207" Number="8" Indent="5">

            <SpanRef IDREF="Span56"/>

          </Line>

          <Line ID="Line208" Number="9" Indent="5">

            <SpanRef IDREF="Span57"/>

          </Line>

          <Line ID="Line209" Number="10" Indent="5">

            <SpanRef IDREF="Span58"/>

          </Line>

          <Line ID="Line210" Number="11">

          </Line>

          <Line ID="Line211" Number="12">

          </Line>

          <Line ID="Line212" Number="13">

            <SpanRef IDREF="Span59"/>

          </Line>

          <Line ID="Line213" Number="14" Indent="5">

            <SpanRef IDREF="Span60"/>

          </Line>

          <Line ID="Line214" Number="15" Indent="5">

            <SpanRef IDREF="Span61"/>

          </Line>

          <Line ID="Line215" Number="16" Indent="5">

            <SpanRef IDREF="Span62"/>

          </Line>

          <Line ID="Line216" Number="17" Indent="5">

            <SpanRef IDREF="Span63"/>

          </Line>

          <Line ID="Line217" Number="18" Indent="5">

            <SpanRef IDREF="Span64"/>

          </Line>

          <Line ID="Line218" Number="19" Indent="5">

            <SpanRef IDREF="Span65"/>

          </Line>

          <Line ID="Line219" Number="20" Indent="5">

            <SpanRef IDREF="Span66"/>

          </Line>

          <Line ID="Line220" Number="21" Indent="5">

            <SpanRef IDREF="Span67"/>

          </Line>

          <Line ID="Line221" Number="22" Indent="5">

            <SpanRef IDREF="Span68"/>

          </Line>

          <Line ID="Line222" Number="23">

          </Line>

          <Line ID="Line223" Number="24">

          </Line>

          <Line ID="Line224" Number="25">

          </Line>

        </Page>

        <Page ID="Page3" Number="405">

          <Line ID="Line300" Number="1" Indent="8">

            <SpanRef IDREF="Span69"/>

          </Line>

          <Line ID="Line301" Number="2" Indent="17">

            <SpanRef IDREF="Span70"/>

          </Line>

          <Line ID="Line302" Number="3" Indent="14">

            <SpanRef IDREF="Span71"/>

          </Line>

          <Line ID="Line303" Number="4" Indent="21">

            <SpanRef IDREF="Span72"/>

          </Line>

          <Line ID="Line304" Number="5" Indent="15">

            <SpanRef IDREF="Span73"/>

          </Line>

          <Line ID="Line305" Number="6">

            <SpanRef IDREF="Span74"/>

          </Line>

          <Line ID="Line306" Number="7">

            <SpanRef IDREF="Span75"/>

          </Line>

          <Line ID="Line307" Number="8" Indent="15">

            <SpanRef IDREF="Span76"/>

          </Line>

          <Line ID="Line308" Number="9">

            <SpanRef IDREF="Span77"/>

          </Line>

          <Line ID="Line309" Number="10" Indent="15">

            <SpanRef IDREF="Span78"/>

          </Line>

          <Line ID="Line310" Number="11">

            <SpanRef IDREF="Span79"/>

          </Line>

          <Line ID="Line311" Number="12">

            <SpanRef IDREF="Span80"/>

          </Line>

          <Line ID="Line312" Number="13">

            <SpanRef IDREF="Span81"/>

          </Line>

          <Line ID="Line313" Number="14" Indent="15">

            <SpanRef IDREF="Span82"/>

          </Line>

          <Line ID="Line314" Number="15">

            <SpanRef IDREF="Span83"/>

          </Line>

          <Line ID="Line315" Number="16">

            <SpanRef IDREF="Span84"/>

          </Line>

          <Line ID="Line316" Number="17">

            <SpanRef IDREF="Span85"/>

          </Line>

          <Line ID="Line317" Number="18" Indent="15">

            <SpanRef IDREF="Span86"/>

          </Line>

          <Line ID="Line318" Number="19">

            <SpanRef IDREF="Span87"/>

          </Line>

          <Line ID="Line319" Number="20">

            <SpanRef IDREF="Span88"/>

          </Line>

          <Line ID="Line320" Number="21" Indent="15">

            <SpanRef IDREF="Span89"/>

          </Line>

          <Line ID="Line321" Number="22">

            <SpanRef IDREF="Span90"/>

          </Line>

          <Line ID="Line322" Number="23">

            <SpanRef IDREF="Span91"/>

          </Line>

          <Line ID="Line323" Number="24" Indent="15">

            <SpanRef IDREF="Span92"/>

          </Line>

          <Line ID="Line324" Number="25">

            <SpanRef IDREF="Span93"/>

          </Line>

        </Page>

        <Page ID="Page4" Number="406">

          <Line ID="Line400" Number="1" Indent="8">

            <SpanRef IDREF="Span94"/>

          </Line>

          <Line ID="Line401" Number="2">

            <SpanRef IDREF="Span95"/>

          </Line>

          <Line ID="Line402" Number="3" Indent="15">

            <SpanRef IDREF="Span96"/>

          </Line>

          <Line ID="Line403" Number="4">

            <SpanRef IDREF="Span97"/>

          </Line>

          <Line ID="Line404" Number="5" Indent="21">

            <SpanRef IDREF="Span98"/>

          </Line>

          <Line ID="Line405" Number="6">

          </Line>

          <Line ID="Line406" Number="7">

            <SpanRef IDREF="Span99"/>

          </Line>

          <Line ID="Line407" Number="8" Indent="5">

            <SpanRef IDREF="Span100"/>

          </Line>

          <Line ID="Line408" Number="9" Indent="5">

            <SpanRef IDREF="Span101"/>

          </Line>

          <Line ID="Line409" Number="10" Indent="5">

            <SpanRef IDREF="Span102"/>

          </Line>

          <Line ID="Line410" Number="11">

            <SpanRef IDREF="Span103"/>
